{
  "$schema": "./schema.json",
  "schemaVersion": 1,
  "kind": "official",
  "tag": "v0.1.0",
  "expectedSourceSha": "1111111111111111111111111111111111111111",
  "original": {
    "releaseContractSha256": "2222222222222222222222222222222222222222222222222222222222222222",
    "rustToolchainSha256": "3333333333333333333333333333333333333333333333333333333333333333",
    "cargoLockSha256": "4444444444444444444444444444444444444444444444444444444444444444",
    "tool": {"name": "cargo-dist", "version": "0.32.0", "sourceUrl": "https://github.com/axodotdev/cargo-dist/releases/download/v0.32.0/cargo-dist-x86_64-unknown-linux-gnu.tar.xz", "archiveSha256": "eb52f9fae0d0506774e9f1801c1168f87fa2c87a45e2d64d3ae7c89401929946", "manifestProducing": true, "manifestSchema": {"sourceUrl": "https://raw.githubusercontent.com/axodotdev/cargo-dist/6886366640dd4da83d33ba55cc04aa58423cbad2/cargo-dist-schema/cargo-dist-manifest-schema.json", "sha256": "d22b592c38c543131d3327c50deba1cfdd3a22e05ac20c9bff4f3e949b9f7f5f", "vendoredPath": "tools/recovery-recipes/schemas/d22b592c38c543131d3327c50deba1cfdd3a22e05ac20c9bff4f3e949b9f7f5f.json"}}
  },
  "replacement": {
    "releaseContractSha256": "5555555555555555555555555555555555555555555555555555555555555555",
    "rustToolchainSha256": "3333333333333333333333333333333333333333333333333333333333333333",
    "cargoLockSha256": "4444444444444444444444444444444444444444444444444444444444444444",
    "tool": {"name": "cargo-dist", "version": "0.32.0", "sourceUrl": "https://github.com/axodotdev/cargo-dist/releases/download/v0.32.0/cargo-dist-x86_64-unknown-linux-gnu.tar.xz", "archiveSha256": "eb52f9fae0d0506774e9f1801c1168f87fa2c87a45e2d64d3ae7c89401929946", "manifestProducing": true, "manifestSchema": {"sourceUrl": "https://raw.githubusercontent.com/axodotdev/cargo-dist/6886366640dd4da83d33ba55cc04aa58423cbad2/cargo-dist-schema/cargo-dist-manifest-schema.json", "sha256": "d22b592c38c543131d3327c50deba1cfdd3a22e05ac20c9bff4f3e949b9f7f5f", "vendoredPath": "tools/recovery-recipes/schemas/d22b592c38c543131d3327c50deba1cfdd3a22e05ac20c9bff4f3e949b9f7f5f.json"}}
  },
  "expectedInventoryDifference": ["regenerate metadata with the repaired contract"],
  "rationale": "The tagged release contract cannot validate the retained draft evidence.",
  "expiresAfter": "2027-01-31",
  "removalCondition": "Remove after v0.1.0 is published and retained evidence verifies."
}
